id,biz_name,Description,website,Tier,Cash,Card,Member Charge,Member Charge Only,description
10001,North Course at La Costa Resort & Spa,"Located north of San Diego in Carlsbad, Omni La Costa Resort & Spa is a legendary golf and wellness getaway in southern California. The resort, which opened in the 1950s, has hosted 37 elite PGA Tour events. The North Course (formerly known as Champions Course) features a serene setting that meanders through peaceful wetlands over landscaped bridges and rolling hills. The course underwent a significant renovation in 2011 by Steve Pate, Damian Pascuzzo and Jeff Brauer, which included four brand new holes and improved irrigation and soil for improved course conditions year-round.Formerly known as Omni La Costa Resort & Spa - Champions Course",https://www.omnihotels.com/hotels/san-diego-la-costa/golf,,,,,,
10006,Arroyo/Lake Course at Cathedral Canyon Country Club,,,,,,,,
10008,Date Palm Springs Country Club,,,,,,,,
10009,El Cielo/La Vista Course at Desert Princess Country Club,,,,,,,,
10010,Eighteen Hole Executive Course at Outdoor Resort & Country Club,,,,,,,,
10013,Highland Springs Village Golf Club,,,,,,,,
10016,Butte Creek Country Club,,https://www.buttecreekcountryclub.com/,,,,,,
10017,Canyon Oaks Country Club,,https://www.canyonoakscc.com/,,,,,,
10020,Western Hills Golf & Country Club,,https://golfwhcc.com/,,,,,,
10022,Sunrise Golf Course,Formerly known as Sunrise Falls Municipal Golf Course.,https://www.madison-in.gov/,,,,,,
10023,Babe Didrikson Zaharias Course at Industry Hills Pacific Palms Resort,,https://ihgolfclub.com/,,,,,,
10025,Oakhurst Country Club,,https://www.oakhurstcc.com/,,,,,,
10026,"Dragon at Gold Mountain, The",,,,,,,,
10027,"Dragon Golf Course, The","Nakoma Golf Resort (previously known as The Dragon at Gold Mountain) is a scenic wonder that will help golfers realize what's so special about Reno and the High Sierras as a golf destination. Challenging play team with unbelievable scenery, giving players a day on the links they won't soon forget.Playing to more than 7,000 yards from the back tees, Nakoma will challenge even scratch golfers with an imposing slope rating of 147. With five tee settings, however, Nakoma Golf Resort has proven to be a golf course that will delight all levels of golfers, as its combination of hazards and risk-reward opportunities make it a challenge worth taking.But the scenery doesn't end on the golf course at Nakoma, which features spa villas and other amenities for golf travelers. Add to that a remarkable clubhouse designed by the legendary architect Frank Lloyd Wright, and you'll easily see why Nakoma Golf Resort has its own special place in the Reno and High Sierras golf scene.",https://nakomaresort.com/,,,,,,
10028,"Golf Club at Whitehawk Ranch, The","Set in the scenic Mohawk Valley, Whitehawk Ranch Golf Club was designed by Dick Bailey and has been ranked as one of the 20 best golf courses in California by <em>Golf Digest.</em> Just a short drive from the golf destinations of Reno and Tahoe, Whitehawk has gained a well-earned reputation as one of the must plays of the High Sierra region.The layout and scenery are the biggest stars of Whitehawk, as Bailey used the natural landscape top carve a course that will take you through steams, waterfalls and ponds, as well as a variety of trees, including pines, cedars and aspens.But golfers will need to keep their eye on the ball as much as the scenery, as Whitehawk plays to nearly 7,000 yards from the back tees with an imposing 130 slope rating. The neat fairways and tricky greens will challenge golfers of all levels, while there are plenty of risk-reward opportunities for daring players. All told, Whitehawk is a High Sierra standout.",https://golfwhitehawk.com/,,,,,,
10030,Yosemite Lakes Park Golf Course,,https://www.yosemitelakespark.org/,,,,,,
10031,Adam Springs Golf Course,,https://www.adamsspringsgolfcourse.com/,,,,,,
10034,Colusa Golf & Country Club,,https://www.colusagolfclub.com/,,,,,,
10038,Auburn Lake Trails Golf Course,,https://www.auburnlaketrails.org/,,,,,,
10039,Saddle Creek Golf Club,,https://saddlecreekgc.com/,,,,,,
10046,Mesa Verde Country Club,,https://www.mesaverdecc.com/,,,,,,
10047,North Course at Coto de Caza Golf & Racquet Club,,https://www.invitedclubs.com/clubs/coto-de-caza-golf-racquet-club,,,,,,
10049,Del Norte Golf Club,,https://www.delnortegolf.com/lander,,,,,,
10054,Destroyer Course at Seal Beach Navy Golf Course,"The Navy Golf Course Seal Beach is a 27-hole facility that includes the championship Destroyer Course and the nine-hole executive Cruiser Course. The 6,780-yard Destroyer Course presents a challenge even for low handicappers with a slew of hazards coming into play throughout. The small greens have challenging slopes ranging from subtle breaks to dramatic drop-offs. To make them even tougher, you'll find strategically placed bunkers lurking along the edges. The tricky doglegs, which are mostly par 4s, will force you to think carefully about your club selection, and to top it all off, water makes an appearance on almost every hole. It's a long golf course that feels even longer due to the rolling terrain, but it is more forgiving than it seems with long, wide fairways that won't penalize you for being slightly errant.",https://sealbeach.navylifesw.com/programs/63c4dee3-9058-4efe-bf4b-a2095e765bcf/,,,,,,
10055,Lake Merced Golf Club,,https://www.lmgc.org/,,,,,,
10056,Monarch Beach Golf Links,"Playing at Monarch Beach Golf Links will bring to mind the great traditions of Scottish links golf. The seaside course offers sweeping views of the oceanfront as well as a challenging and diverse layout. Robert Trent Jones, Jr. designed the golf course, fully utilizing the dramatic bluffs and natural beauty of the landscape. The course offers small, rolling greens and tight fairways that are both kept in excellent condition. Strategically placed bunkers wait treacherously throughout the course and there are a number of tricky doglegs to watch out for. The course is on the shorter side but it is an excellent place to work on your iron game. Monarch Beach Golf Links' par-4 third hole is one of the most difficult. It plays along the ocean but don't let the views distract from the challenging green that is dramatically undulated.",https://www.monarchbeachgolf.com/,,,,,,
10057,Falls Course at Blackhawk Country Club,,https://www.blackhawkcc.org/,,,,,,
10058,Crow Canyon Country Club,,http://www.crow-canyon.com/,,,,,,
10061,Dos Rios Golf Club,,https://www.dosriosgolf.net/,,,,,,
10063,Lake Tamarisk Golf Course,,https://laketamarisk.com/,,,,,,
10065,Desert Crest Country Club,,https://denemebonusu.co.bz/,,,,,,
10067,Mission Lakes Country Club,,https://www.missionlakescountryclub.com/,,,,,,
10069,Diablo Country Club,,https://www.diablocc.org/,,,,,,
10071,Dove Canyon Country Club,,https://www.dovecanyongc.com/,,,,,,
10074,Los Amigos Country Club,,https://www.losamigosgc.com/,,,,,,
10077,Muroc Lake Golf Course,,https://edwardsfss.com/,,,,,,
10079,Oak Glen Course at Singing Hills Country Club At Sycuan,,,,,,,,
10081,Serrano Country Club,,https://serranocountryclub.org/,,,,,,
10084,Mira Vista Golf & Country Club,"Mira Vista CC opened in 1987 with a Tom Wieskopf/Jay Morrish design. The parkland-style layout rolls through hills of native grasses and wildflowers, sweeping around three lakes that spice up the course.The duo’s design isn’t overly long, playing only 7,020 yards from the tips, but it boasts three par 4s over 450 yards and several long par 5s, including the 647-yard No. 6. This monster doglegs left inside a cliff that runs along the right side. Out-of-bounds is left, and a fairway bunker resides about a lob wedge from the narrow green, which is bolstered from behind by more bunkers.No. 18 is one of the more interesting finishing holes that you’ll come across, featuring two dogleg fairways, one right and one left, that both involve dealing with the creek that splits the two routes. The tee shot right is more favorable, since it is void of fairway bunkers like the ones on the left side. However, this option involves carrying two bunkers and the creek on the approach.Getting there : From I-20 west, take the Bryant/Irvin Rd. exit and turn left. Drive 2.5 miles to the course. The entrance is on the right side of the street.",https://miravistacountryclub.com/,,,,,,
10085,El Macero Country Club,,https://www.elmacerocc.org/,,,,,,
10090,Valley Hi Country Club,,https://www.valleyhicc.com/,,,,,,
10094,Escondido Country Club,,https://www.valleescondidoboquete.com/,,,,,,
10095,Meadow Lake Golf Club,,http://golfmeadowlakesask.com/,,,,,,
10096,Castle Creek Country Club,,https://idlidosacoffee.com/,,,,,,
10099,The Fountains Executive Course at Welk Resort - San Diego,"The Fountain is one of two 18-hole golf courses at the Welk Resort San Diego. The other course, the Oaks, is an 18-hole, par-3 course that is great short-game practice for all skill levels. Although the Fountain is an executive-length course, it is as formidable as most full-length golf courses. Even low handicappers will be tested by the narrow layout, which covers a variety of elevation changes that range from subtle to dramatic. In addition to a slew of strategically placed bunkers and trees that demand accuracy, water hazards also come into play on a few holes. There are many risk-reward opportunities throughout the course where good strategy will reap many benefits. The golf course has some tricky holes but it is not overly punishing, making it more approachable for a wide range of skill levels.",https://www.jcgolf.com/san-diego-tee-times,,,,,,
10103,Meadow Club,,https://www.meadowclub.com/,,,,,,
10104,North Ridge Country Club,,https://www.northridgegolf.com/,,,,,,
10106,Pala Mesa Resort,"Pala Mesa Golf Resort is situated between Temecula wine country and the beautiful countryside of San Diego's North County. The course was carefully carved from the surrounding hillsides, providing rolling fairways and undulating greens throughout the layout. Towering oaks, sycamores, and elms blanket the course's landscape, providing the perfect complement to the stunning mountain views. The fairways are tight and lined with trees, demanding a fair amount of accuracy. The greens also play fairly quick. The golf course does provide a challenging round but it is seemingly much tougher than it actually is. Beginners should still feel comfortable taking on the course. The versatile layout in combination with the consistently good conditions have earned Pala Mesa acclaim as one of the best golf courses in San Diego County.",https://www.palamesa.com/,,,,,,
10107,The Golf Club of California,"Situated just outside of Temecula, the Golf Club of California enjoys a scenic landscape provided by the rolling hills north of San Diego. The terrain is ideal for a round of golf, offering verdant acres of countryside blanketed with mature oaks, sycamores, and towering eucalyptus trees and accented with redtop grasses, which border the carefully manicured fairways and greens. Although there is an abundance of trees, the course still has many wide-open areas. The pristine white sand bunkers and colorful wildflowers are a beautiful contrast to the lush green of the course. The layout is not particularly long, but golfers should be prepared for a challenging round of target golf. The course features narrows fairways, plenty of elevation changes, and tricky greens that require an accurate approach. There are also a few meandering creeks that come into play.",https://www.thegolfclubofcalifornia.com/,,,,,,
10110,Elkins Ranch Golf Course,,,,,,,,
10114,Redwood Empire Golf & Country Club,,https://www.redwoodempiregolf.com/,,,,,,
10118,Belmont Country Club,,https://www.thebelmontcountryclub.com/,,,,,,
10119,Copper River Country Club,,https://www.copperrivercountryclub.com/,,,,,,
10120,Fig Garden Golf Course,,,,,,,,
10121,Fort Washington Golf & Country Club,"A valley course with rolling hills, tree-lined fairways and fast greens. It is among the top 20 in North California. Private course first opened in 1923.",https://www.fortwashingtoncc.org/,,,,,,
10125,San Joaquin Country Club,,https://www.sjcc.cc/,,,,,,
10126,Sunnyside Country Club,,https://www.sunnysidecountryclub.com/,,,,,,
10137,Chevy Chase Country Club,"Chevy Chase Country Club (formerly known as Traditions at Chevy Chase Country Club) in Wheeling is one of Chicagoland's top public golf facilities. Thomas Bendelow designed the golf course in 1925. The classic layout remained largely the same until 2002 when a major renovation updated the course and made it more challenging. The layout now has deep pot bunkers lined with tall native fescue that border the generous, rolling greens and undulating fairways. Though it is more challenging than it was, the golf course still offers a player-friendly round. Four sets of tees also ensure that golfers can play to their skill level. The course finishes with its signature hole, a par 5 that features water both left and right of the landing area off the tee. Three massive bunkers and yet another pond all fiercely guard the green as well.",https://www.chevychasecountryclub.com/,,,,,,
10138,Oakmont Country Club,,https://www.oakmontcc.com/,,,,,,
10141,Glendora Country Club,,https://www.glendoracountryclub.com/,,,,,,
10144,Encina Royale Golf Course,,,,,,,,
10146,Graeagle Meadows Golf Course,"Known for its stunning mountain and river views, Graeagle Meadows Golf Course is located along the middle fork of the Feather River in the High Sierras. The landscape is covered with towering pine trees and shimmering lakes providing not only a scenic setting but also a challenging terrain for golf. In addition to the natural features, there are also mounded greens and strategically placed bunkers that complement the dramatic elevation changes of the golf course. Elevated tees allow golfers to enjoy panoramic views of the surrounding meadows, forest, and mountains. The sixth is Graeagle Meadows Golf Course's signature hole and one of its most scenic with views of the Mohawk Valley and the town of Graeagle.",https://playgraeagle.com/,,,,,,
10148,Granite Bay Golf Club,,https://www.invitedclubs.com/clubs/granite-bay-golf-club,,,,,,
10149,Pine Mountain Lake Country Club,,https://www.pinemountainlake.com/,,,,,,
10151,Nevada County Country Club,,https://nevadacountygolf.com/,,,,,,
10152,Alta Sierra Country Club,,https://www.altasierracc.com/,,,,,,
10153,Wildwood Mobile Country Club,,,,,,,,
10154,Ocean Course at Half Moon Bay Golf Links,,https://www.halfmoonbaygolf.com/,,,,,,
10157,Kings Country Club,,https://www.kingscountryclub.net/,,,,,,
10163,East/South Course at Silver Lakes Country Club,,,,,,,,
10165,Colonial Country Club,"Colonial Country Club, located in Fort Worth on the southern banks of the Trinity River and near TCU, is one of the most historic golf clubs in Texas. The club was founded in 1936 by Marvin Leonard, who sought to have a north Texas club with smooth, bent grass greens (unheard of at the time, as many courses had either sand or Bermuda turf). The course was originally designed by Texan John Bredemus and Oklahoma architect Perry Maxwell, who formally worked with Dr. Alister Mackenzie. Holes no. 3-5 are nicknamed the “Horrible Horseshoe” and represent the strongest stretch on the course, featuring a 247-yard par-3 4th hole bookended by long and demanding par 4s. Colonial Country Club hosted the 1941 U.S. Open, won by Craig Wood and was the first time the event was staged in Texas. Despite now playing over 7,200 yards, Colonial maintains a reputation to this day as a ball-striker’s playground. Ben Hogan won the Colonial golf tournament five times. Other multiple winners of this longstanding PGA Tour event include Lee Trevino, Billy Casper, Nick Price and Ben Crenshaw.",https://www.colonialgolfclub.com/,,,,,,
10166,Arroyo Fairways Mobile Home Club & Golf Course,,,,,,,,
10171,Hesperia Golf & Country Club,,http://www.golfhesperiaparks.com/,,,,,,
10172,Burlingame Country Club,,https://burlingameccwnc.com/,,,,,,
10173,Gabilan Course at Ridgemark Golf & Country Club Resort,,,,,,,,
10175,Barbara Worth Golf Resort,,http://ww12.barbaraworth.net/?usid=20&utid=13972744718,,,,,,
10177,SeaCliff Country Club,,http://www.seacliffcc.net/,,,,,,
10178,Desert Horizons Country Club,,https://deserthorizons.org/,,,,,,
10179,Eldorado Country Club,,https://www.eldoradocc.org/,,,,,,
10180,"The East Course at Golf Resort at Indian Wells, The",,,,,,,,
10181,Cove/West Cove Course at Indian Wells Country Club,,,,,,,,
10182,"Reserve, The",,https://www.thereserveclub.com/,,,,,,
10183,"Desert Course at Vintage Club, The",,https://www.thevintageclub.com/,,,,,,
10184,Indian/Mountain Course at Indian Palms Country Club,,,,,,,,
10185,Heritage Palms Golf Club,"The mountains are close enough to touch at this Arthur Hills design. Heritage Palms measures 6,698 yards from the back tees.Four lakes are featured on the course, which is very green for a desert design. Hills contrast the fairways against the mountains and the desert in the distance, but this is very much a resort type course.The par 3s are particularly inventive. This isn't one of Hills' tougher courses. It offers average hackers the chance to have a largely anxiety-free round. As long as they don't get too carried away with club selection.There are a number of dogleg holes that force you to think before firing away. Just hitting as far as you can is an easy path to trouble. It's the shot after the shot you're hitting that must be thought of.",https://www.heritagepalmsindio.com/,,,,,,
10188,Plantation Golf Course,,https://www.theplantationgc.com/,,,,,,
10189,Rancho Casa Blanca Country Club,,https://rcboa.com/,,,,,,
10195,Canyon/Meadow Course at Steele Canyon Golf & Country Club,,,,,,,,
10196,Kern Valley Country Club,Editor's Note: Course closed for business in 2018.,https://www.kernvalleygolfcourse.com/,,,,,,
10199,Kings River Golf & Country Club,,https://krgcc.com/,,,,,,
10201,La Canada Flintridge Country Club,,https://lcfcountryclub.com/,,,,,,
10202,Hidden Hills Resort & Golf Club,,,,,,,,
10204,Hacienda Golf Club,,https://www.haciendagolfclub.com/,,,,,,
10205,La Jolla Beach & Tennis Club,,https://www.ljbtc.com/,,,,,,
10206,La Jolla Country Club,,https://www.lajollacountryclub.com/,,,,,,
10209,Championship Course at Indian Springs Golf & Country Club,,,,,,,,
10210,La Quinta Country Club,,https://www.lqcc.org/,,,,,,
10211,Citrus Course at La Quinta Resort & Club,,,,,,,,
10213,"Palms Golf Club, The",,http://www.palmsgolf.com.au/,,,,,,
10214,Arnold Palmer Private Course at PGA WEST,"The site of David Duval's historic final-round 59 in 1999, the Arnold Palmer Private Course at PGA WEST is set at the base of the picturesque Santa Rosa Mountains.The golf course opened in 1986 as the second of five championship courses at PGA WEST. It has 30 acres of lakes and streams, several elevated tees and plenty of large trees dotting the rolling terrain. The finishing stretch is particularly appealing with five holes sculpted along the rugged mountains. The 15th is a little par 3 with virtually no room for error; the 16th is a short par 4 that requires players to cross a canal twice; the 17th is another beautiful short par 3; and the finishing hole is a spectacular risk-reward par 5 around a lake.",https://www.pgawest.com/,,,,,,
10215,"Quarry, The",Previously known as Links at Quarry Oaks Golf and Country Club - Oak/Quarry,https://quarryoaks.ca/,,,,,,
10216,Rancho La Quinta Golf Course,,https://www.rancholaquinta.com/,,,,,,
10218,Par 3 Practice Course at Tradition Golf Club,,,,,,,,
10221,Sierra La Verne Country Club,,,,,,,,
10222,Aliso Creek Golf Course,,,,,,,,
10223,1 & 2 Course at Laguna Hills Golf Course at Leisure World,,,,,,,,
10225,Lake Almanor Country Club,,https://www.lakealmanorcountryclub.com/,,,,,,
10228,Executive Course at Lake San Marcos Country Club,,,,,,,,
10238,Catta Verdera Golf Club,,,,,,,,
10247,Crystalaire Country Club,,https://www.crystalairecountryclub.com/,,,,,,
10251,"Village Country Club, The",,https://innsbrookruidoso.com/,,,,,,
10261,Los Altos Golf & Country Club,,https://www.lagcc.com/,,,,,,
10262,La Rinconada Country Club,,https://www.larinconadacc.com/,,,,,,
10263,Brentwood Country Club,"Brentwood is a 1980s-style course with narrow fairways, loads of out-of-bounds, and water in play on more than half the holes.Two par 5s stand out on the front: the opening 540-yard eye-opener, and the 517-yard No. 6, considered the toughest hole of the front nine.On the back, the par 5 530-yard 15th hole is rated as the most difficult.Getting there : From I-10 east, take the Walden Rd. exit and turn left. Drive approximately 4 miles and turn left onto Major Dr. The course is .5 mile down the road, and the entrance is on the left side of the street.",https://www.brentwoodccbeaumont.com/,,,,,,
10264,Bel-Air Country Club,,https://www.bel-aircc.golf/,,,,,,
10267,Hillcrest Country Club,,https://www.hillcrestok.com/,,,,,,
10268,"North Course at Los Angeles Country Club, The",,https://www.thelacc.org/,,,,,,
10271,Lake/North Course at Mountain Gate Country Club,,,,,,,,
10275,Wilshire Country Club,,https://www.wilshirecountryclub.com/,,,,,,
10276,Sea Pines Golf Resort,"Sea Pines Golf Resort is situated at the southern tip of Borro Bay, with the ocean neighboring it to one side and the Montana de Oro State Park and charming village of Los Osos on the other. This ideal spot is just minutes from the area's wine country and the attractions of historic San Luis Obispo. The nine-hole layout offers beautiful views of the bay and Morro Rock from almost every hole. Carefully preserved coastal dunes shape the landscape, giving the layout the same feel as a course you would find in the British Isles. Known for being one of California's most challenging executive golf courses, the par 4s are particularly memorable. Besides the course, Sea Pines Golf Resort also boasts a practice facility with a driving range, two putting greens, and a chipping area.",https://www.seapinesgolfresort.com/,,,,,,
10277,Madera Golf & Country Club,,http://maderagcc.com/wordpress/,,,,,,
10280,Paradise Pines Golf Course,,,,,,,,
10282,Sierra Star Golf Club,,https://www.mammothmountain.com/,,,,,,
10288,Peach Tree Golf & Country Club,,https://www.peachtreecountryclub.com/,,,,,,
10289,Plumas Lake Golf & Country Club,"Established in 1926, Plumas Lake Golf & Country Club has long been one of the Sacramento Valley's most treasured courses. First opened as a nine-hole layout, the course expanded to a full 18 holes in 1960. Mature oak trees line the lush fairways and small greens and there is also a canal that snakes through the entire property, coming into play on 12 holes. There are also strategically placed bunkers protecting the greens. You're in for a formidable test on this golf course but the rough is quite manageable and the layout isn't particularly long or hilly. Plumas Lake's 10th is one of the most memorable holes. This tough hole is a short par 5 that requires an accurate drive over a creek that crosses the fairway before you're faced with an elevated green.",https://plumaslake.com/,,,,,,
10292,Beau Pre Golf Club,,https://www.hugedomains.com/domain_profile.cfm?d=beaupregolf.com,,,,,,
10293,Winchester Country Club,,https://wcc1923.com/,,,,,,
10294,Sharon Heights Golf & Country Club,,https://www.sharonheightsgcc.com/,,,,,,
10295,Merced Golf & Country Club,,http://www.mercedgolfandcountryclub.com/,,,,,,
10297,Hidden Valley Lake Golf & Country Club,,https://www.golfhvl.com/,,,,,,
10299,Green Hills Country Club,,https://greenhillscc.com/,,,,,,
10305,Mission Viejo Country Club,,https://www.missionviejocc.com/,,,,,,
10309,Bluff/River Course at Del Rio Country Club,,,,,,,,
10310,801 Stewart Rd,,,,,,,,
10315,Del Monte Golf Course,"Opened in 1897, Del Monte™ Golf Course is the oldest course in continuous operation west of the Mississippi. Designed by golf and polo enthusiast Charles Maud, this inland course boasts a meandering, hilly layout that has challenged golfers for more than a century.It was the original host of the California State Amateur-still played on Del Monte's narrow, tree-lined fairways and small,well-protected greens-and continues to serve as one of the three courses on which the Callaway Golf Pebble Beach Invitational is played.Adjacent to Del Monte™ Golf Course, the Del Monte Pavilion offers an inviting outdoor setting for any special event. Whether you are hosting a corporate outing or a tournament awards ceremony, all events are impeccably catered by the Lodge at Pebble Beach.",https://www.pebblebeach.com/,,,,,,
10317,Naval Postgraduate School Golf Course,,,,,,,,
10318,Pasadera Country Club,,,,,,,,
10323,Moraga Country Club,,https://www.moragacc.com/,,,,,,
10327,Mount Shasta Resort,,https://www.mountshastaresort.com/,,,,,,
10331,Bear Creek Golf & Country Club,,https://www.bearcreekgc.com/,,,,,,
