id,biz_name,Description,website,Tier,Cash,Card,Member Charge,Member Charge Only,description
10332,"Colony Country Club, The","Perhaps one day the greatness that is Crown Colony will finally supplant Fort Worth's Colonial Country Club as Texas' finest golf course. For now this course, which opened in the late 1970s, may have to wait a few more decades for its legend to grow. The course is certainly worthy, offering immaculate conditions paired with demanding target golf. Water is in play on 13 holes, the pine-lined fairways feature numerous elevation changes, and the greens are small targets.The best hole on the front is No. 4, about a 180-yarder all over water, but you're bound to notice the opening set of holes that feature two monster par 5s. The 583-yard No. 3 bends left around a lake and plays to a tricky little green nestled against water's edge.On the back, you'll remember the ender-an almost 600-yard tree-lined monster. And the preceding 203-yard No. 17 isn't the way to build confidence for the finisher. Together the two finishing holes can absolutely destroy your round.Getting there : From Houston, take Hwy. 59 north. Exit Champions Dr. and you will see the course.",https://crown-colony.site/,,,,,,
10334,The Club Shakespeare Course at Chardonnay Golf Club,,,,,,,,
10335,Eagle Vines Golf Club,"Eagle Vines Vineyards & Golf Club is tucked away in the foothills of Napa Valley, offering one of the most scenic courses in the area. It is also considered by many locals to be one of the most challenging. Every hole on the golf course provides stunning views of the surrounding vineyards. The layout sprawls across gently rolling hills that weave through stands of mature cherry and oak trees, shimmering waterfalls, and meandering creeks. The golf course offers challenging multi-tiered greens and postage-stamp landing areas that demand well placed iron shots. The memorable seventh hole features an even more difficult island green. There are also some tricky fairways that seem much more open than they are. Eagle Vines numerous risk-reward opportunities that will have golfers using every club in their bag.",https://www.eaglevinesgolfclub.com/,,,,,,
10337,Napa Valley Country Club,,https://www.napavalleycc.com/,,,,,,
10338,North Course at Silverado Country Club & Resort,,,,,,,,
10341,Friendly Valley Golf Course,,https://www.friendlyvalleyhomesforsale.com/,,,,,,
10342,The Ocean South Course at Pelican Hill Golf Club,,https://www.pelicanhill.com/,,,,,,
10343,Rio La Paz Golf Club,Formerly known as Jockey Club La Paz.,https://www.facebook.com/people/Golf-Club-Social-La-Paz/100065190902187/,,,,,,
10345,Big Canyon Country Club,,https://www.bigcanyoncc.org/,,,,,,
10346,"Newport Beach Country Club, The","Formerly known as ""Irvine Coast Country Club"".",https://www.newportbeachcc.com/,,,,,,
10350,Porter Valley Country Club,,https://www.invitedclubs.com/clubs/porter-valley-country-club,,,,,,
10352,Oakdale Golf & Country Club,,https://www.oakdalegcc.com/,,,,,,
10353,Indian Valley Golf Club,,https://www.ivgc.com/,,,,,,
10354,Marin Country Club,,https://www.marincountryclub.com/,,,,,,
10356,Claremont Country Club,,https://claremontcountryclubnh.com/,,,,,,
10360,Sequoyah Country Club,,https://www.sequoyahcc.com/,,,,,,
10362,El Camino Country Club,,https://www.elcaminoclub.com/,,,,,,
10363,Ocean Hills Country Club,,https://www.oceanhillscountryclub.com/,,,,,,
10366,Ojai Valley Inn & Spa,"Opened in 1923, Ojai Valley Inn Golf Course is one of California's first great courses. Over the decades that the course has been open, it has hosted a number of professional players and celebrities ranging from Arnold Palmer to Will Smith. George C. Thomas, Jr., who created the Riviera, collaborated with Billy Bell to design the original golf course but Jay Morrish made the layout considerably more challenging with renovations in 1988. Ten years later, two holes from the original Thomas/Bell layout that were lost during a redesign following WWII were completely restored and incorporated into the layout. The challenging golf course is very narrow in some spots and it features undulating greens that putt fast and true. The layout is not particularly long but it requires accuracy and proper club selection in order to score well.",https://www.ojaivalleyinn.com/,,,,,,
10371,Orinda Country Club,,https://www.orindacc.org/,,,,,,
10372,Kelly Ridge Country Club,,,,,,,,
10379,"Riviera Country Club, The","For decades the most decorated golf course in Hollywood, The Riviera Country Club is one of L.A.’s three glittering masterpieces by Golden Age golf course architect George Thomas. Starting from one of golf’s most iconic first-tee perches, the golfer descends, climbs and winds through valleys, over barrancas that come into play on several holes and finally uphill to the amphitheater 18th green.Riviera is home to one of the game’s most recognizable par 3s and one of its great short par 4s. The former is the short 6th hole, with a pot bunker in the middle of the sweeping, multi-tiered green. The latter: the 10th, whose broad fairway and strategic bunkering gives way to one of the toughest-to-hit putting surfaces in the world. Even the best golfers in the world routinely make scores from 2 to 8 there.In addition to the PGA Tour’s annual Genesis Invitational, Riviera has a considerable major championship pedigree, including a U.S. Open (1948) and two PGA Championships (1983, 1995).",https://www.therivieracountryclub.com/,,,,,,
10380,Avondale Golf Club,,https://avondalegolfclub.co.nz/,,,,,,
10381,The Canyons Course at Bighorn Golf Club,,,,,,,,
10382,Chaparral Country Club,,https://www.chaparralcc.org/,,,,,,
10384,Desert Falls Country Club,"Can bunkers qualify as their own continent? Desert Falls Country Club in Palm Desert seems determined to find out.This Ron Frehm design boasts bunkers so huge that they look like the inventor of the Big Gulp came up with them. And escape is anything but guaranteed. Sometimes getting out of one bunker, just means landing in another at Desert Falls.That is just part of the reason this course totes a 145 slope rating - putting it among the five highest slope ratings in the entire Palms Springs area. Remember, this is the golf mecca with Pete Dye's Stadium Course, which was only designed to be ""the toughest golf course in the world."" Desert Falls is on that list.There are five sets of tees to take away some of the bite. But the greens are still an obstacle of their own. These are undulating greens that are large enough to offer several varieties of challenges.Just getting on the green is not enough at Desert Falls. It's important to land on the right part of the green. This is also a course with more hills than you expect to see in the desert.",https://www.desertfallsgolf.com/,,,,,,
10385,Emerald Desert Country Club,,,,,,,,
10387,"Golf Course at Marriott's Shadow Ridge Resort, The",,,,,,,,
10388,Arroyo/Grove East Course at Indian Ridge Country Club,,,,,,,,
10389,North Course at Ironwood Country Club,,https://www.ironwoodcountryclub.com/,,,,,,
10390,"East/South Course at Lakes Country Club, The",,,,,,,,
10391,Marrakesh Golf Club,,https://www.marrakeshcountryclub.com/,,,,,,
10392,Palms Course at Marriott's Desert Springs Resort,"Desert Springs Resort has a longstanding reputation as a luxury resort that offers something for everyone. There are two championship golf courses that sprawl across beautifully landscaped grounds covered with lush vegetation and sparkling lagoons, providing a scenic oasis amidst the desert surroundings. From nearly every hole at the resort, golfers can enjoy panoramic views of the Coachella Valley and Santa Rosa Mountains. Water is the most prominent feature of both golf courses. Between the two of them, over 35 acres of water features come into play. The Palms Course is the slightly more challenging layout of the two, but both are accessible to players of all skill levels. The layout features well guarded greens, thick rough and towering palm trees bordering the holes. It has a memorable finishing stretch that starts with an island par-3 on the 17th and finishes with a tricky dogleg par 4 with water all along the left side.",http://www.desertspringsresort.com/,,,,,,
10393,East/ West Course at Monterey Country Club,,,,,,,,
10394,Oasis Country Club,,https://www.theoasiscountryclub.com/,,,,,,
10395,The Championship Course at Palm Desert Country Club,,,,,,,,
10396,Palm Desert Greens Country Club,,https://www.pdgcc.org/,,,,,,
10397,Palm Desert Resort Country Club,,https://www.theresorter.com/landing/,,,,,,
10398,Challenger Course at Palm Valley Country Club,,https://www.palmvalley-cc.com/,,,,,,
10399,Portola Country Club,,https://portolacc.com/,,,,,,
10400,Santa Rosa Country Club,Editor's Note: Course closed for business in 2015. There are plans for converting the land into a residential area.,http://www.santarosaccpd.com/,,,,,,
10401,Shadow Mountain Golf Club,,https://www.shadowmtgc.com/,,,,,,
10402,San Jacinto/San Gorgonio Course at Sun City Palm Desert Golf Course,,,,,,,,
10403,Suncrest Country Club,,,,,,,,
10404,Woodhaven Country Club,"Located in the heart of the Palm Desert in the Coachella Valley, Woodhaven Country Club offers panoramic views that stretch across the San Jacinto and Santa Rosa Mountains. The golf course has a traditional desert landscape but the stunning mountain views elevate it to a truly unique experience. The course has a classic design that is player friendly enough for beginners and even gentle enough juniors. It may not be what you're looking for if you want a formidable test, but more advanced players will appreciate it for a quick casual round. It's also great for working on your short game skills. The golf course is short and tight with immaculately manicured greens. You won't find much water at Woodhaven Country Club except on the 17th, which seems like its nearly all water.",https://www.woodhavencc.com/,,,,,,
10405,Canyon Country Club,,https://www.dovecanyongc.com/,,,,,,
10407,Mesquite Golf & Country Club,,,,,,,,
10408,O'Donnell Golf Club,,https://www.odonnellgolfclub.com/,,,,,,
10409,Seven Lakes Country Club,,https://www.facebook.com/SevenLakesGCC/,,,,,,
10411,Legend Course at Tahquitz Creek Golf Resort,,https://tahquitzgolfresort.com/,,,,,,
10413,Antelope Valley Country Club,,https://antelopevalleycountryclub.com/,,,,,,
10416,Palo Alto Hills Golf & Country Club,,https://www.pahgcc.com/,,,,,,
10418,Palos Verdes Golf Club,,https://www.pvgc.com/,,,,,,
10419,Palo Cedro Golf Club,,https://graperanchgolfclub.com/,,,,,,
10424,Annandale Golf Course,,https://www.annandalegolf.com/,,,,,,
10427,Pauma Valley Country Club,,https://www.paumavalleycc.com/,,,,,,
10428,Cypress Point Club,,,,,,,,
10429,"Links at Spanish Bay, The","Designed by Robert Trent Jones, Jr., Tom Watson and Frank ""Sandy"" Tatum, The Links at Spanish Bay™ is America's foremost Scottish-style linksland course; even the rugged Monterey coastline mirrors the natural beauty of Scotland.From the rolling fairways, white sand dunes and gusting winds to the plaintive strains of the bagpipe that signals the end of each day's play, The Links at Spanish Bay™ is an elegant, challenging journey into golf's beginnings.",https://www.pebblebeach.com/golf/the-links-at-spanish-bay/,,,,,,
10430,Dunes Course at Monterey Peninsula Country Club,,https://www.mpccpb.org/,,,,,,
10431,Golf Links Course at Pebble Beach Golf Links,"The Hay was redesigned by Tiger Woods' TGR Design, reopening in April 2021 as a 670-yard short course, complemented by a putting course free for everybody that can be set up for 6, 12 or 18 holes of play. The Hay features plaques on every tee to commemorate famous golfers who have made their marks at Pebble Beach Resorts. While the routing is meant to be fun and playable for all, its greens are demanding with all sorts of contours. The most notable hole is the 106-yard second, created as an exact replica of the famous 7th hole on Pebble Beach Golf Links.",https://www.pebblebeach.com/golf/the-hay/,,,,,,
10433,Spyglass Hill Golf Course,"""If it were human, Spyglass would have a knife in its teeth, a patch on its eye, a ring in its ear, tobacco in its beard and blunderbuss in its hand . . ."" -- Jim Murray, Los Angeles TimesWith a name inspired by the Robert Louis Stevenson novel Treasure Island, Spyglass Hill is the toughest golf course in Northern California and among the most difficult in the world (ratings are from the championship tees). Designed by the legendary Robert Trent Jones and opened in 1966, the course was immediately recognized as a true test of golf skills and an opportunity to utilize every club in the bag. ""The Glass"" hosts the annual AT&T Pebble Beach National Pro-Am, as well as qualifying rounds for the California State Amateur.",https://www.pebblebeach.com/golf/spyglass-hill-golf-course/,,,,,,
10435,Petaluma Golf & Country Club,,https://www.petalumagolfandcountryclub.com/,,,,,,
10437,Lake Wildwood Golf Course,,https://www.lwwa.org/,,,,,,
10439,Pine Mountain Golf Club,,https://pinemountainclub.net/,,,,,,
10440,Mace Meadow Golf & Country Club,Editor's Note: Course closed for business in 08/2023.,,,,,,,
10442,Alta Vista Country Club,,https://altavistacc.com/,,,,,,
10443,Cold Springs Golf & Country Club,,https://www.coldspringsgolf.com/,,,,,,
10445,Hill Course at Castlewood Country Club,,https://www.castlewoodcc.org/,,,,,,
10447,Ruby Hill Golf Club,,https://www.rubyhill.com/,,,,,,
10451,Seabee Golf Club of Port Hueneme,,https://ventura.navylifesw.com/,,,,,,
10453,River Island Country Club,,https://inline4you.com/,,,,,,
10454,Maderas Golf Club,"Maderas Golf Club is one of San Diego's most popular courses. Although it is less than an hour from Torrey Pines, it has a stunning landscape and challenging design that rivals that of the famed seaside course. Maderas may not have the ocean views, but its beautiful landscape provides just as much scenery. Nestled inland amongst rolling hills, the golf course weaves through rocky cliffs and outcroppings. There are mature trees throughout as well as a meandering creek and over forty acres of native wildflowers. There are three sparkling lakes and five waterfalls that come into play on the course. The demanding layout features difficult greens that are large and lightning fast. Several tricky uphill and downhill lies can be found throughout Maderas Golf Club thanks to the hilly terrain.",https://www.maderasgolf.com/,,,,,,
10455,Stoneridge Country Club,,,,,,,,
10457,San Vicente Inn & Golf Club,,,,,,,,
10458,Rancho Bernardo Golf Club,,,,,,,,
10459,Rancho Bernardo Inn,,https://www.ranchobernardoinn.com/,,,,,,
10461,Red Hill Country Club,,https://www.redhillcc.com/,,,,,,
10462,"Club at Morningside, The",,https://www.clubatmorningside.com/,,,,,,
10463,Desert Island Golf & Country Club,,,,,,,,
10464,North/South Course at Marriott's Rancho Las Palmas Resort & Country Club,,,,,,,,
10465,Arnold Palmer Course at Mission Hills Country Club,,,,,,,,
10466,Rancho Mirage Country Club,"This course sits at the intersection of two of the most famous roads in Palm Springs: Bob Hope Drive and Frank Sinatra Drive. Yet, it's one of the better kept secrets in the golf scene. Rancho Mirage Country Club in Ranch Mirage is a semi-private club available to outside play through stay & play packages so it does not do a lot of publicity.There are 10 lakes, tons of palm trees and the snow-capped San Jacinto Mountains to catch your eyes. The course itself is largely flat and inviting for the average hacker. It measures only 6,111 yards from the back tees. But its 122-slope rating is a little deceivingly given how small many of the greens are. It still takes good shots to post a good number at Rancho Mirage.There are also lighted tennis courts at the complex, allowing golfers to make a day & night of it, if they wish.",,,,,,,
10467,"Springs Club, The",Formerly known as Armadale Country Club.,https://www.armadalegolf.club/,,,,,,
10468,Sunrise Country Club,,https://www.sunrisecountryclub.com/,,,,,,
10469,Tamarisk Country Club,,https://www.tamariskcc.com/,,,,,,
10470,Thunderbird Country Club,,https://www.thunderbirdcc.org/,,,,,,
10471,"Mission Hills North Course at Westin Mission Hills Resort, The",,,,,,,,
10474,Lakes to Ocean Course at Fairbanks Ranch Country Club,,,,,,,,
10475,Del Mar Country Club,,https://www.delmarcountryclub.com/,,,,,,
10476,"Bridges at Rancho Santa Fe, The",,https://www.thebridgesrsf.com/,,,,,,
10477,East/South Course at Morgan Run Resort & Club,,,,,,,,
10478,Rancho Santa Fe Farms Golf Club,,https://www.thefarmsgolfclub.com/,,,,,,
10479,Rancho Santa Fe Golf Club,,http://www.rsfgc.com/,,,,,,
10480,South Course at Rancho Murieta Country Club,,https://www.ranchomurietacc.com/,,,,,,
10482,Wilcox Oaks Golf Club,,http://www.wilcoxoaks.com/,,,,,,
10484,Redlands Country Club,,https://www.redlandscountryclub.com/,,,,,,
10488,Gold Hills Country Club,Formerly known as Country View Golf Course - Red/Gold.,https://hiddenhillsgcc.com/,,,,,,
10489,"Golf Club Tierra Oaks, The",,https://www.tierraoaksgolfclub.com/,,,,,,
10491,River Bend Golf & Country Club,,https://www.rbgcc.org/,,,,,,
10492,Riverview Golf & Country Club,,https://www.facebook.com/morris.golfcourse,,,,,,
10496,Richmond Country Club,,http://www.richmondcc.ca/,,,,,,
10497,China Lake Golf Course,,https://chinalake.navylifesw.com/,,,,,,
10500,Spring Creek Golf Course & Country Club,,https://www.springcreekcc.com/,,,,,,
10501,Eagle Creek Golf Club,"Eagle Creek is a British style course, from the bunkers to the chipping areas. It is a new 18-hole 7,198 yard-Par73 championship Orlando golf course and is located minutes from Orlando International Airport, near Lake Nona. Ron Garl and Howard Swan collaborated to design a course that has an old world charm with modern amenities. Eagle Creek is the first course in Florida to use the technologically advanced Mini-Verde grass, resulting in exceptionally fast and vibrant greens. Eagle Creek is a designated Audubon Silver Signature Course with lush landscaping and challenging play that features over 90 white sand bunkers reminiscent of those found in Scotland and England, with extensive bulkheads embracing water hazards and over 1,500 trees lining its breathtaking fairways.",https://www.eaglecreekorlando.com/,,,,,,
10503,Canyon Crest Country Club,,http://www.canyoncrestcc.com/,,,,,,
10512,Victoria Club,,https://www.victoriaclub.com/,,,,,,
10513,Sunset Whitney Country Club,,,,,,,,
10515,North Course at Foxtail Golf Club,"Foxtail Golf Club in Rohnert Park offers two championship courses, the North and the South, situated in the heart of wine country. The North Course originally opened in 1974 but underwent a major renovation that completely redesigned the layout, improving its conditions and making it more challenging. The par-72 North is considerably longer and more difficult than the par-71 South. The North features multiple doglegs and strategically placed sand traps that will test even the most experienced players. To make the golf course a bit more approachable, water hazards don't play a prominent role, though they do appear on a few holes, and the forward tees are very player friendly. With 36 holes available, Foxtail G.C. is able to host tournaments and events while still having another 18 holes open to the public.",https://www.playfoxtail.com/,,,,,,
10518,Sierra View Country Club,,https://www.sierraviewcc.org/,,,,,,
10519,Lakes/Oaks Course at Sun City Roseville Golf Course,,,,,,,,
10521,Rolling Hills Country Club,,https://www.rollinghillscabot.com/,,,,,,
10528,Del Paso Country Club,,http://www.delpasocc.org/,,,,,,
10529,Foothill Golf Center,,,,,,,,
10535,Meadowood Resort Hotel,,,,,,,,
10536,Arrowhead Country Club,,https://arrowheadccrc.com/,,,,,,
10539,Corral de Tierra Country Club,"Nestled in the foothills near the famed Monterey Peninsula, the serene Corral de Tierra Country Club (a proprietary Club) offers a challenging golf course as its dramatic centerpiece for a true Country Club experience. Measuring 6708 yards from the championship tees (137 slope), and designed with four sets of tees, the course is enjoyed by all levels of golfers. Manicured and well-bunkered greens set off the lush fairways which are well defined by towering sycamores, scented pine, cypress and native oak.A complete Country Club in every sense, Corral de Tierra's golf activities, well stocked pro shop and friendly staff are overseen by a PGA golf professional. There are complete locker room facilities for men and women, a driving range, and practice putting greens.",https://www.corraldetierracc.com/,,,,,,
10542,Salinas Golf & Country Club,,,,,,,,
10543,Carnoustie/Muirfield Course at Pacific Golf & Country Club,,,,,,,,
10547,3 Par at Four Points,,https://www.marriott.com/en-us/hotels/sanfp-four-points-by-sheraton-san-diego/overview/?EM=DNM_FOURPOINTSSANDIEGOHOTEL.COM,,,,,,
10548,North Course at Admiral Baker Golf Course,,https://www.navylifesw.com/,,,,,,
10550,Bernardo Heights Country Club,,https://www.invitedclubs.com/clubs/the-heights-golf-club,,,,,,
10553,DoubleTree Carmel Highland Resort,,,,,,,,
10555,Miramar Memorial Golf Course,,https://miramar.usmc-mccs.org/,,,,,,
10558,Naval Station Golf Course,,,,,,,,
10559,North Island Golf Club,,https://www.northstradbrokeislandgolfclub.com.au/,,,,,,
10561,Friars/Presidio Course at Riverwalk Golf Club,,,,,,,,
10564,Sea 'n' Air Golf Course,,http://seanairgc.org/,,,,,,
10565,East Course at The Grand Golf Club,,,,,,,,
10570,"Cliffs Course at Olympic Club, The",,https://www.olyclub.com/,,,,,,
10572,San Francisco Golf Club,,,,,,,,
10574,Via Verde Country Club,,https://viaverdecc.com/,,,,,,
10578,Marbella Country Club,,https://www.marbellacc.net/,,,,,,
10583,San Luis Obispo Golf & Country Club,,,,,,,,
10584,CordeValle Golf Club,"Just a half hour's drive south from San Jose, CordeValle Golf Club is a private golf club that offers tee times to its resort guests. The golf course sits on 260 acres of hillsides, canyons and wetlands and is part of a protected 1,000-acre piece of natural land and comes with no real estate development surrounding the course. Designed by Robert Trent Jones Jr., CordeValle Golf Club features four sets of tees, 150 feet of elevation change and has been ranked among America's best golf resorts by a variety of publications including Conde Nast Traveler and Golf Digest.",https://cordevalle.com/,,,,,,
10586,Peacock Gap Country Club,"Peacock Gap Golf Club extends along the shores of San Pablo Bay, but it sits inland enough to avoid the fogginess of the coast and enjoy consistently sunny weather throughout the year. The course's layout has undergone many renovations over the years that have brought it to its current playability, including a new drainage system, new tee boxes, a reshaping of five of the greens, and relocation of bunkers. The golf course kept the classic features of its original layout though, such as the inviting fairways that still provide a challenge and the tricky greens that deceptively extend past where the player thinks they end. In addition to the course, Peacock Gap has also improved their practice facilities over the years. There is an all-grass driving range, two large practice greens, and a chipping green.",https://www.peacockgapgolfclub.com/,,,,,,
10587,"Peninsula Golf & Country Club, The",,https://thepgcc.org/,,,,,,
10594,Santa Ana Country Club,,https://www.santaanacc.org/,,,,,,
10596,Birnam Wood Golf Club,,https://www.bwgc.net/,,,,,,
10598,Hidden Oaks Country Club,,https://ww12.hiddenoaksgolfsb.net/?usid=15&utid=32049968221,,,,,,
10599,La Cumbre Country Club,,https://www.lacumbrecc.org/,,,,,,
10600,Montecito Country Club,,https://www.montecitocc.com/,,,,,,
10601,Rancho San Marcos Golf Course,Editor's Note: Course closed for business in 2020.,,,,,,,
10603,Valley Club of Montecito,,https://www.valleyclub.org/,,,,,,
10608,Pasatiempo Golf Club,"This classic golf course is arguably one of the top venues in the country. Pasatiempo was certainly one of designer Alister MacKenzie's favorites. The legendary architect made his home off the par-5 sixth hole and regarded the difficult, uphill 16th as one of the best par 4s ever designed by him or anyone else. To make it even better, the golf club embarked on a two-year restoration project headed up by Tom Doak. The result was nothing less than spectacular as bunkers and greens were to returned original specifications with modern turf and drainage technology. With its great design and elevation changes, Pasatiempo Golf Club plays much longer than its yardage and will test good players. The back nine is particularly strong, perhaps as good as any in the country.",https://www.pasatiempo.com/,,,,,,
10610,Santa Maria Country Club,,http://www.santamariacc.com/,,,,,,
10614,Mountain View Golf Course,,https://www.mvgolfclub.com/,,,,,,
10617,Fountaingrove Resort & Country Club,,,,,,,,
10618,West Course at Oakmont Golf Club,,,,,,,,
10619,Santa Rosa Golf & Country Club,,https://www.invitedclubs.com/clubs/santa-rosa-golf-country-club,,,,,,
10621,Saratoga Country Club,,https://www.saratogacc.com/,,,,,,
